{
  "schemaVersion": "forge.m5.repair-rerun-link/v1",
  "rerunLinkId": "repair-rerun-link-00000000-0000-4000-8000-000000000001",
  "projectId": "m5-selector-repair",
  "repairOriginId": "repair-origin-00000000-0000-4000-8000-000000000001",
  "repairLineageHash": "ffdf0fbf59fb4774b10e5f5c3de00981375e2ff66314c11c829bce503d002ff3",
  "resultingDefinitionAuthority": {
    "testSetRowId": 802,
    "testSetId": "test-set-v3-7c568c867a2989a6b842e917",
    "testSetRevision": 8,
    "testSetContentHash": "1baa6753e3a0cc86f79010993e048c36da492a11848dfab80822773663935b10",
    "definitionId": "test-v3-flow-7ef3777aaca635cd0bfcf289",
    "definitionContentHash": "0292a4f53f01c5edb8b8c36d5a75553f5b9fc951f123755d9ebd3987a13e7994",
    "modelRowId": 52,
    "modelVersion": "2.0.0",
    "supportSealHash": "bbbbbbbbbbbbbbbbbbbbbbbbbbbbbbbbbbbbbbbbbbbbbbbbbbbbbbbbbbbbbbbb"
  },
  "executionAuthority": {
    "executionId": "execution-repair-1",
    "itemOrdinal": 1,
    "planHash": "7777777777777777777777777777777777777777777777777777777777777777",
    "runId": "run-repair-1",
    "attemptOrdinal": 1,
    "resultId": "result-repair-1"
  },
  "suiteAuthority": null,
  "persistedAuthorities": {
    "execution": {
      "projectId": "m5-selector-repair",
      "executionId": "execution-repair-1",
      "origin": "product",
      "manifest": [
        {
          "itemOrdinal": 1,
          "definitionAuthority": {
            "testSetRowId": 802,
            "testSetId": "test-set-v3-7c568c867a2989a6b842e917",
            "testSetRevision": 8,
            "testSetContentHash": "1baa6753e3a0cc86f79010993e048c36da492a11848dfab80822773663935b10",
            "definitionId": "test-v3-flow-7ef3777aaca635cd0bfcf289",
            "definitionContentHash": "0292a4f53f01c5edb8b8c36d5a75553f5b9fc951f123755d9ebd3987a13e7994",
            "modelRowId": 52,
            "modelVersion": "2.0.0",
            "supportSealHash": "bbbbbbbbbbbbbbbbbbbbbbbbbbbbbbbbbbbbbbbbbbbbbbbbbbbbbbbbbbbbbbbb"
          },
          "planHash": "7777777777777777777777777777777777777777777777777777777777777777"
        }
      ],
      "suiteAuthority": null
    },
    "run": {
      "projectId": "m5-selector-repair",
      "runId": "run-repair-1",
      "executionId": "execution-repair-1",
      "origin": "product",
      "attemptOrdinal": 1
    },
    "result": {
      "projectId": "m5-selector-repair",
      "resultId": "result-repair-1",
      "runId": "run-repair-1",
      "itemOrdinal": 1,
      "definitionId": "test-v3-flow-7ef3777aaca635cd0bfcf289",
      "planHash": "7777777777777777777777777777777777777777777777777777777777777777"
    }
  },
  "recordedAt": "2026-09-03T19:00:00.000Z",
  "rerunLinkHash": "6314270e74ceb68777d51ede14c3a1f2c2ba11077327da95b5a749b17532cc79"
}
